cnp;pack;lab;gh_ou_hmr3;pvp;pva;desconto;iva_valor
5129598;Amiodarona GP (MG) Comp 200mg 10;GP;GH0016 - Amiodarona | A101 | Oral | 200 mg | [1-20];2,23;1,1253584905660377;0,0;0,06
5086004;Galantamina Azevedos (MG) Comp revest 8mg 56;Azevedos;GH0710 - Galantamina | A101 | Oral | 8 mg | [21-60];29,0;18,67;0,6166999999999999;0,06
5330881;Risperidona Sandoz (MG) Comp revest 1mg 60;Sandoz;GH0461 - Risperidona | A101 | Oral | 1 mg | [21-60];9,701981833195706;6,764382053399395;0,6;0,06
5127402;Atenolol Azevedos (MG) Comp revest 100mg 56;Azevedos;GH0023 - Atenolol | A101 | Oral | 100 mg | [21-60];5,83;4,28;0,45;0,06
5185905;Levocetirizina Krka (MG) Comp revest 5mg 14;Krka;GH0763 - Levocetirizina | A101 | Oral | 5 mg | [1-20];3,49;2,24;0,5;0,06
5203823;Sildenafil GP (MG) Comp revest 100mg 4;GP;GH0000 - Sem Grupo Homogéneo;21,53;15,239746107709767;0,45;0,06
5373279;Irbesartan/Hidroclorotiazida Krka (MG) Comp revest 150mg+12.5mg 14;Krka;GH0855 - Irbesartan + Hidroclorotiazida | A101 | Oral | 150 mg + 12.5 mg | [1-20];2,68;1,53;0,35;0,04
5377080;Finasterida Sandoz (MG) Comp revest 5mg 60;Sandoz;GH0379 - Finasterida | A101 | Oral | 5 mg | [21-60];11,61;7,824110499169508;0,3;0,06
5656426;Pregabalina Mylan (MG) Cáps 300mg 56;Mylan;GH1036 - Pregabalina | A101 | Oral | 300 mg | [21-60];26,96;20,11;0,5;0,06
2785194;Diclofenac Labesfal Generis (MG) Comp gastrorresistente 50mg 60;Generis;GH0176 - Diclofenac | A103 | Oral | 50 mg | [21-60];4,26;2,89;0,35;0,06
5399001;Perindopril/Indapamida Azevedos (MG) Comp 2mg+0.625mg 30;Azevedos;GH0702 - Perindopril + Indapamida | A101 | Oral | 2 mg + 0.625 mg 2.5 mg + 0.625 mg | [21-60];8,7;5,92;0,45;0,06
5463963;Esomeprazol GP (MG) Comp gastrorresistente 20mg 56;GP;GH0817 - Esomeprazol | A103 | Oral | 20 mg | [21-60];12,21;8,352679367700613;0,0;0,06
4424198;Ticlopidina Bluepharma (MG) Comp revest 250mg 20;Bluepharma;GH0136 - Ticlopidina | A101 | Oral | 250 mg | [1-20];3,85;2,54;0,0;0,06
2202992;Ticlopidina GP (MG) Comp revest 250mg 10;GP;GH0136 - Ticlopidina | A101 | Oral | 250 mg | [1-20];2,36;1,25;0,2;0,06
5504790;Captopril GP (MG) Comp 50mg 60;GP;GH0034 - Captopril | A101 | Oral | 50 mg | [21-60];5,88;4,304999999999963;0,5;0,06
5474846;Memantina TAD (MG) Comp revest 10mg 28;Krka;GH0923 - Memantina | A101 | Oral | 10 mg | [1-30];10,99;7,32;0,5;0,06
5697503;Ivabradina Sandoz (MG) Comp revest 7.5mg 56;Sandoz;GH1119 - Ivabradina | A101 | Oral | 7.5 mg | [21-60] unidades;19,02;13,034319318880014;0,0;0,06
4483996;Ciprofloxacina Bluepharma (MG) Comp revest 500mg 1;Bluepharma;GH0168 - Ciprofloxacina | A101 | Oral | 500 mg | [1-5];1,79;0,74;0,0;0,04
5462031;Rivastigmina Sandoz Cáps 6mg 28;Sandoz;GH0908 - Rivastigmina | A101 | Oral | 6 mg | [1-30];21,87062188345918;15,53640119675167;0,0;0,06
5039953;Finasterida Azevedos (MG) Comp revest 5mg 56;Azevedos;GH0379 - Finasterida | A101 | Oral | 5 mg | [21-60];10,84;7,19;0,45;0,06
5698600;Dutasterida Krka (MG) Cáps mole 0.5mg 10;Krka;GH1102 - Dutasterida | A101 | Oral | 0.5 mg | [1-20] unidades;3,23;2,01;0,5;0,06
5480249;Irbesartan/Hidroclorotiazida Aurobindo (MG) Comp revest 150mg+12.5mg 14;Generis;GH0855 - Irbesartan + Hidroclorotiazida | A101 | Oral | 150 mg + 12.5 mg | [1-20];2,58;1,43;0,15;0,06
5669023;Rasagilina GP (MG) Comp 1mg 10;GP;GH1070 - Rasagilina | A101 | Oral | 1 mg | [1-20] unidades;14,1;9,998679245283016;0,5;0,06
5385174;Perindopril Azevedos (MG) Comp 8mg 30;Azevedos;GH0704 - Perindopril | A101 | Oral | 8 mg 10 mg | [21-60];8,24;5,52;0,6;0,06
5326426;Levofloxacina Bluepharma (MG) Comp revest 250mg 7;Bluepharma;GH0481 - Levofloxacina | A101 | Oral | 250 mg | [6-16];4,12;2,77;0,3;0,06
5026000;Losartan/Hidroclorotiazida Krka (MG) Comp revest 50mg+12.5mg 14;Krka;GH0486 - Losartan + Hidroclorotiazida | A101 | Oral | 50 mg + 12.5 mg | [1-20];4,06;2,73;0,58;0,06
6033449;Otoxolan Gotas Auric Susp Cão 20ml;Krka;H21.16.1. - Produtos otológicos;18,2;13,0;0,3;0,23
5642525;Sinvastatina Bluepharma (MG) Comp revest 10mg 14;Bluepharma;GH0230 - Sinvastatina | A101 | Oral | 10 mg | [1-20];1,41;0,41;0,0;0,04
5222245;Donepezilo GP (MG) Comp revest 10mg 56;GP;GH0726 - Donepezilo | A101 | Oral | 10 mg | [31-60];11,36;7,603926669653924;0,45;0,06
5636840;Pregabalina Lek (MG) Cáps 50mg 56;Sandoz;GH1029 - Pregabalina | A101 | Oral | 50 mg | [21-90];11,4;7,640528018183408;0,5;0,06
5622949;Olmesartan Medoxomilo Aurobindo (MG) Comp revest 10mg 14;Generis;GH1087 - Olmesartan medoxomilo | A101 | Oral | 10 mg | [1-20] unidades;2,79;1,61;0,0;0,06
5647201;Pregabalina Bluepharma (MG) Cáps 25mg 14;Bluepharma;GH1027 - Pregabalina | A101 | Oral | 25 mg | [1-20];1,06;0,1;0,0;0,06
5037023;Finasterida GP (MG) Comp revest 5mg 14;GP;GH0378 - Finasterida | A101 | Oral | 5 mg | [1-20];3,58;2,304480722324943;0,25;0,06
5291372;Rosuvastatina Sandoz (MG) Comp revest 10mg 20;Sandoz;GH1113 - Rosuvastatina | A101 | Oral | 10 mg | [1-20] unidades;7,66;4,982547993019198;0,0;0,06
5654629;Ziprasidona Aurovitas (MG) Cáps 20mg 56;Generis;GH0945 - Ziprasidona | A101 | Oral | 20 mg | [21-60] unidades;43,23;31,13;0,51;0,06
5291349;Rosuvastatina Sandoz (MG) Comp revest 5mg 20;Sandoz;GH1111 - Rosuvastatina | A101 | Oral | 5 mg | [1-20] unidades;5,25;3,755991285403051;0,0;0,06
5187075;Lansoprazol Bluepharma (MG) Cáps gastrorresistente 15mg 14;Bluepharma;GH0429 - Lansoprazol | A103 | Oral | 15 mg | [1-20];2,88;1,69;0,0;0,06
7344168;Calshake Cart Pó Baunilha 7x87g;Fresenius Kabi;H13.4.9. - Outra alimentação específica;27,4911;19,95;0,25;0,06
7364513;Glutamine Plus Cart Pó Neutro 30x22.4g;Fresenius Kabi;H13.2.6. - Outro suplemento;144,54531000000003;104,89500000000001;0,25;0,06
5742663;Tadalafil GP (MG) Comp revest 10mg 4;GP;GH0000 - Sem Grupo Homogéneo;19,54;13,56;0,4;0,06
5582226;Montelucaste Sandoz (MG) Gran saq 4mg 7;Sandoz;GH0996 - Montelucaste | A112 | Oral | 4 mg | [1-20];4,8942229729729725;3,4459459459459456;0,4;0,06
5711833;Sinvastatina/Ezetimiba Krka (MG) Comp 10mg+10mg 14;Krka;GH1120 - Sinvastatina + Ezetimiba | A101 | Oral | 10 mg + 10 mg | [1-20] unidades;10,75;7,11;0,58;0,06
5090352;Paroxetina Aurobindo (MG) Comp revest 20mg 10;Generis;GH0220 - Paroxetina | A101 | Oral | 20 mg | [1-20];2,09;1,0;0,15;0,06
2177681;Levotuss Xar frasco 6mg/ml 200ml;Mylan;H01.1.2. - Antitússicos;8,55;5,9;0,0;0,06
5005897;Amlodipina GP (MG) Comp 10mg 60;GP;GH0147 - Amlodipina | A101 | Oral | 10 mg | [21-60];6,65;4,9787233747295705;0,5;0,06
5686100;Celecoxib Generis (MG) Cáps 100mg 60;Generis;GH1018 - Celecoxib | A101 | Oral | 100 mg | [21-60];3,81;2,5;0,35;0,06
5629761;Alopurinol Labesfal (MG) Comp 300mg 60;Generis;GH0314 - Alopurinol | A101 | Oral | 300 mg | [21-60];3,69;2,4;0,4;0,06
5728167;Ramipril Generis (MG) Cáps 5mg 56;Generis;GH0296 - Ramipril | A101 | Oral | 5 mg | [21-60];12,21;8,35;0,5;0,06
5726328;Solifenacina Generis (MG) Comp revest 5mg 30;Generis;GH1164 - Solifenacina | A101 | Oral | 5 mg | [11-30] unidades;6,5;4,85;0,35;0,06
5603576;Rivastigmina Bluepharma (MG) Sist transder 4.6mg/24h 7;Bluepharma;GH0963 - Rivastigmina | A204 | Transdérmica | 4.6 mg/24 h | [1-10] unidades;5,93;4,35;0,0;0,06
5706924;Etoricoxib TAD (MG) Comp revest 120mg 7;Krka;GH1107 - Etoricoxib | A101 | Oral | 120 mg | [1-8] unidades;4,94;3,5;0,0;0,06
2177780;Levotuss Sol oral gta 60mg/ml 30ml;Mylan;H01.1.2. - Antitússicos;10,57;7,29;0,0;0,06
5106042;Meloxicam Bluepharma (MG) Comp 15mg 60;Bluepharma;GH0410 - Meloxicam | A101 | Oral | 15 mg | [21-60];6,58;4,92;0,4;0,06
5061841;Etinilestradiol/Gestodeno Generis (MG) Comp revest 0.02mg+0.075mg 21;Generis;GH0586 - Etinilestradiol + Gestodeno | A101 | Oral | 0.02 mg + 0.075 mg | [1-30];3,11;1,89;0,4;0,06
5728175;Ramipril Generis (MG) Cáps 10mg 56;Generis;GH0298 - Ramipril | A101 | Oral | 10 mg | [21-60];17,7;11,88;0,5;0,06
5086301;Galantamina Generis (MG) Comp revest 8mg 56;Generis;GH0710 - Galantamina | A101 | Oral | 8 mg | [21-60];39,91;28,2;0,35;0,06
5681366;Quetiapina Generis (MG) Comp LP 150mg 30;Generis;GH1085 - Quetiapina | A102 | Oral | 150 mg | [11-60] unidades;17,16;11,4;0,4;0,06
5043138;Pantoprazol Krka (MG) Comp gastrorresistente 20mg 14;Krka;GH0618 - Pantoprazol | A103 | Oral | 20 mg | [1-20];2,76;1,6;0,58;0,06
5451224;Pioglitazona Actavis (MG) Comp 30mg 28;Generis;GH0836 - Pioglitazona | A101 | Oral | 30 mg | [21-60];17,3;11,52;0,65;0,06
4394086;Fluconazol Sandoz (MG) Cáps 50mg 7;Sandoz;GH0185 - Fluconazol | A101 | Oral | 50 mg | [1-7];10,98824806849029;7,280573536576878;0,0;0,06
4736294;Indapamida GP (MG) Comp revest 2.5mg 60;GP;GH0196 - Indapamida | A101 | Oral | 2.5 mg | [21-60];7,8;5,14;0,55;0,06
5421185;Keplat Emplastro 20mg 7;Azevedos;GH0000 - Sem Grupo Homogéneo;16,47;10,86;0,15;0,06
2662591;Sucralfato Mylan (MG) Susp oral saq 1000mg/5ml 60;Mylan;GH0130 - Sucralfato | A112 | Oral | 1000 mg/5 ml | [21-60];5,1;3,64;0,0;0,06
9454710;Betadine Pda 100mg/g 100g;Mylan;H09.1.2. - Desinfectante Feridas;8,1;5,59;0,0;0,06
5047683;Beta-histina Generis (MG) Comp 16mg 60;Generis;GH0343 - Beta-histina | A101 | Oral | 16 mg | [21-60];4,42;3,03;0,4;0,06
5314422;Ibuprofeno Generis (MG) Gran sol oral saq 600mg 20;Generis;GH0846 - Ibuprofeno | A112 | Oral | 600 mg | [1-20];3,82;2,51;0,4;0,06
5694054;Etoricoxib Sandoz Farmacêutica (MG) Comp revest 120mg 7;Sandoz;GH1107 - Etoricoxib | A101 | Oral | 120 mg | [1-8] unidades;6,41;4,7668845315904145;0,0;0,06
5169669;Venlafaxina Mylan (MG) Cáps LP 37.5mg 30;Mylan;GH0538 - Venlafaxina | A102 | Oral | 37.5 mg | [21-60];5,4;3,91;0,5;0,06
2898096;Metoclopramida Labesfal Comp 10mg 20;Generis;GH0000 - Sem Grupo Homogéneo;1,81;0,76;0,2;0,06
5105978;Meloxicam Bluepharma (MG) Comp 7.5mg 60;Bluepharma;GH0407 - Meloxicam | A101 | Oral | 7.5 mg | [21-60];5,42;3,9;0,4;0,06
5043112;Ramipril/Hidroclorotiazida Mylan (MG) Comp 5mg+25mg 56;Mylan;GH0571 - Ramipril + Hidroclorotiazida | A101 | Oral | 5 mg + 25 mg | [21-60];8,32;5,59;0,0;0,06
5120589;Ibuprofeno Generis (MG) Comp revest 400mg 60;Generis;GH0089 - Ibuprofeno | A101 | Oral | 400 mg | [21-60];4,26;2,89;0,6;0,06
4993184;Indapamida Mylan (MG) Comp revest 2.5mg 30;Mylan;GH0196 - Indapamida | A101 | Oral | 2.5 mg | [21-60];4,26;2,91;0,4;0,06
5289657;Esomeprazol Krka (MG) Cáps gastrorresistente 40mg 56;Krka;GH0818 - Esomeprazol | A103 | Oral | 40 mg | [21-60];16,54;10,92;0,58;0,06
5271036;Paracetamol Azevedos (MG) Comp 1000mg 18;Azevedos;GH0700 - Paracetamol | A101 | Oral | 1000 mg | [1-20];2,37;1,26;0,45;0,06
5375159;Irbesartan Bluepharma (MG) Comp revest 300mg 28;Bluepharma;GH0675 - Irbesartan | A101 | Oral | 300 mg | [21-60];9,35;6,46;0,4;0,06
4507596;Diazepam Labesfal Generis Comp 10mg 40;Generis;GH0055 - Diazepam | A101 | Oral | 10 mg | [21-60];2,21;1,11;0,15;0,06
3211786;Calcium D Sandoz Comp eferv 1500mg+400UI 60;Sandoz;GH0000 - Sem Grupo Homogéneo;7,9;5,191972076788831;0,0;0,06
5760244;Aprepitant Generis (MG) Cáps 125mg 1;Generis;GH0000 - Sem Grupo Homogéneo;19,61;13,55;0,0;0,06
5680624;Amlodipina/Valsartan TAD (MG) Comp revest 5mg+80mg 56;Krka;GH1100 - Amlodipina + Valsartan | A101 | Oral | 5 mg + 80 mg | [21-60] unidades;13,05;9,08;0,58;0,06
5747860;Galantamina Aurovitas (MG) Cáps LP 24mg 28;Generis;GH0822 - Galantamina | A102 | Oral | 24 mg | [21-60];41,12;29,27;0,44;0,06
5775853;Silodosina Aurovitas (MG) Cáps 8mg 30;Generis;GH1172 - Silodosina | A101 | Oral | 8 mg | [21-60] unidades;6,55;4,89;0,4;0,06
5341649;Bisoprolol Aurobindo (MG) Comp revest 2.5mg 20;Generis;GH0842 - Bisoprolol | A101 | Oral | 2.5 mg | [1-20];2,43;1,3;0,35;0,06
4332987;Sinvastatina Bluepharma (MG) Comp revest 20mg 56;Bluepharma;GH0128 - Sinvastatina | A101 | Oral | 20 mg | [21-60];5,9;4,32;0,5;0,06
4484192;Ciprofloxacina Bluepharma (MG) Comp revest 500mg 16;Bluepharma;GH0052 - Ciprofloxacina | A101 | Oral | 500 mg | [9-16];10,87;7,18;0,55;0,06
9589622;Choliatron Comp 40mg 60;Lusomedicamenta;GH0000 - Sem Grupo Homogéneo;24,115;15,96;0,0;0,06
5731096;Beta-histina Generis (MG) Comp 24mg 60;Generis;GH0501 - Beta-histina | A101 | Oral | 24 mg | [21-60];5,93;4,35;0,35;0,06
7353128;Fresubin Protein Sol Oral Chocolate 4x200ml;Fresenius Kabi;H13.1.5. - Alimentação completa hiperproteica e hipercalórica;14,49656;10,52;0,25;0,06
6104505;Sterimar Mn Spray Nasal Água Mar c/ Manganésio 100ml;Mylan;H01.3.1. - Preparações nasais de água do mar;10,62;7,32;0,0;0,06
5065487;Bisoprolol Sandoz (MG) Comp revest 5mg 56;Sandoz;GH0345 - Bisoprolol | A101 | Oral | 5 mg | [21-60];5,010523648648649;3,547297297297298;0,6799999999999999;0,06
5125836;Donepezilo Bluepharma (MG) Comp revest 10mg 56;Bluepharma;GH0726 - Donepezilo | A101 | Oral | 10 mg | [31-60];12,65;8,73;0,35;0,06
5273883;Amissulprida Generis (MG) Comp 50mg 60;Generis;GH0545 - Amissulprida | A101 | Oral | 50 mg | [21-60];9,86;6,9;0,3;0,06
5470133;Pravastatina Aurobindo (MG) Comp 20mg 60;Generis;GH0227 - Pravastatina | A101 | Oral | 20 mg | [21-60];8,97;6,13;0,4;0,06
5187117;Lansoprazol Bluepharma (MG) Cáps gastrorresistente 15mg 56;Bluepharma;GH0430 - Lansoprazol | A103 | Oral | 15 mg | [21-60];6,22;4,6;0,5;0,06
5204144;Sildenafil Bluepharma (MG) Comp revest 50mg 8;Bluepharma;GH0000 - Sem Grupo Homogéneo;34,0;22,98;0,55;0,06
5370135;Arankelle (MG) Comp revest 3mg+0.02mg 63;Gedeon Richter;GH0922 - Drospirenona + Etinilestradiol | A101 | Oral | 3 mg + 0.02 mg | [31-90];10,55;6,94;0,15;0,06
4484291;Ciprofloxacina Bluepharma (MG) Comp revest 750mg 16;Bluepharma;GH0053 - Ciprofloxacina | A101 | Oral | 750 mg | [9-16];16,55;10,87;0,55;0,06
5260559;Atorvastatina Azevedos (MG) Comp revest 20mg 28;Azevedos;GH0787 - Atorvastatina | A101 | Oral | 20 mg | [21-60];3,57;2,3;0,45;0,06
5339585;Terbinafina Generis (MG) Comp 250mg 14;Generis;GH0368 - Terbinafina | A101 | Oral | 250 mg | [1-20];9,13;6,27;0,35;0,06
4354387;Lovastatina Generis (MG) Comp 20mg 60;Generis;GH0000 - Sem Grupo Homogéneo;4,72;3,29;0,25;0,06
5036298;Sucralfato Generis (MG) Susp oral saq 1000mg/5ml 20;Generis;GH0129 - Sucralfato | A112 | Oral | 1000 mg/5 ml | [1-20];3,6;2,32;0,2;0,06
5712591;Ansilor Comp 2.5mg 60;Generis;GH0783 - Lorazepam | A101 | Oral | 2.5 mg | [21-60];4,89;3,44;0,0;0,06
9745828;Broncoliber Cáps LP 120mg 20;Tecnimede;H01.1.1. - Expectorantes;0,0;6,65;0,4;0,06
7070953;Tonicê Complete Sol Oral Amp 20x10ml;Generis;H05.3.1. - Tónico Adulto;11,2;6,5;0,15;0,23
5646146;Baclofeno Generis (MG) Comp 25mg 60;Generis;GH1064 - Baclofeno | A101 | Oral | 25 mg | [21-60] unidades;9,38;6,48;0,38;0,06
5315387;Itraconazol Aurovitas (MG) Cáps 100mg 32;Generis;GH0327 - Itraconazol | A101 | Oral | 100 mg | [17-32];16,18;10,54;0,3;0,06
5260542;Atorvastatina Azevedos (MG) Comp revest 10mg 56;Azevedos;GH0786 - Atorvastatina | A101 | Oral | 10 mg | [21-60];3,76;2,47;0,45;0,06
6712836;Sterimar Spray Nasal Água Mar 100ml;Mylan;H01.3.1. - Preparações nasais de água do mar;9,04;6,23;0,0;0,06
9454728;Betadine Pda 100mg/g 30g;Mylan;H09.1.2. - Desinfectante Feridas;5,23;3,61;0,0;0,06
8436014;Betadine Esp cut 40mg/ml 500ml;Mylan;H09.1.2. - Desinfectante Feridas;7,54;5,2;0,0;0,06
9599258;Nimed Comp revest 100mg 20;Azevedos;GH0382 - Nimesulida | A101 | Oral | 100 mg | [1-20];4,82;3,4;0,6166999999999999;0,06
8254060;Brufen Comp revest 200mg 20;Mylan;H02.1.1. - Analgésicos e Antipiréticos;4,33;2,99;0,0;0,06
8610949;Dumyrox Comp revest 50mg 60;Mylan;GH0772 - Fluvoxamina | A101 | Oral | 50 mg | [21-60];11,2;7,51;0,0;0,06
2003499;Benaderma Gel 20mg/g 50g;Generis;H09.1.5. - Antialérgicos Pele;8,75;6,5;0,15;0,06
3685096;Atenolol Generis (MG) Comp revest 50mg 60;Generis;GH0027 - Atenolol | A101 | Oral | 50 mg | [21-60];3,94;2,61;0,35;0,06
5228549;Cloreto de Tróspio Generis (MG) Comp revest 20mg 60;Generis;GH0765 - Cloreto de tróspio | A101 | Oral | 20 mg | [21-60];9,44;6,54;0,1;0,06
5349352;Broncoliber Sol oral frasco 50mg/ml 13ml;Tecnimede;H01.1.1. - Expectorantes;0,0;7,0;0,25;0,06
5546783;Klacid Comp revest 500mg 16;Mylan;GH0172 - Claritromicina | A101 | Oral | 500 mg | [6-16];13,41;9,45;0,0;0,06
5410394;Beta-histina Bluepharma (MG) Comp 16mg 20;Bluepharma;GH0342 - Beta-histina | A101 | Oral | 16 mg | [1-20];2,48;1,34;0,0;0,06
5573019;Memantina Bluepharma (MG) Comp revest 10mg 56;Bluepharma;GH0924 - Memantina | A101 | Oral | 10 mg | [31-60];14,08;9,98;0,45;0,06
5395066;Tramadol/Paracetamol Mylan (MG) Comp revest 37.5mg+325mg 20;Mylan;GH0735 - Tramadol + Paracetamol | A101 | Oral | 37.5 mg + 325 mg | [1-20];1,64;0,62;0,0;0,06
5406087;Omeprazol Generis Cáps gastrorresistente 10mg 14;Generis;GH1080 - Omeprazol | A103 | Oral | 10 mg | [1-20] unidades;3,86;2,54;0,5;0,06
5021522;Fentanilo Sandoz (MG) Sist transder 25mcg/h 5;Sandoz;GH0564 - Fentanilo | A204 | Transdérmica | 25 µg/h | [1-30];9,583691164327002;6,661161574456372;0,6;0,06
5227202;Levocetirizina Aurovitas (MG) Comp revest 5mg 21;Generis;GH0759 - Levocetirizina | A101 | Oral | 5 mg | [21-60];4,24;2,88;0,4;0,06
3464195;Lovastatina Labesfal (MG) Comp 20mg 60;Generis;GH0000 - Sem Grupo Homogéneo;4,72;3,29;0,25;0,06
5369855;Candesartan/Hidroclorotiazida Krka (MG) Comp 16mg+12.5mg 28;Krka;GH0876 - Candesartan + Hidroclorotiazida | A101 | Oral | 16 mg + 12.5 mg | [21-60];6,48;4,85;0,58;0,06
5392865;Escitalopram Sandoz (MG) Comp revest 10mg 56;Sandoz;GH0853 - Escitalopram | A101 | Oral | 10 mg | [21-60];9,5;6,5881326352530545;0,6;0,06
9645721;Magnesiocard Pó sol oral saq 1229.6mg 20;Tecnimede;H05.4.1. - Suplementos Magnésio;0,0;5,8;0,23;0,06
5170618;Cilazapril/Hidroclorotiazida Krka (MG) Comp revest 5mg+12.5mg 56;Krka;GH0000 - Sem Grupo Homogéneo;12,76;8,88;0,35;0,06
3653987;Fluoxetina Generis (MG) Sol oral frasco 4mg/ml 140ml;Generis;GH0186 - Fluoxetina | A112 | Oral | 4 mg/ml | >74;8,09;5,36;0,4;0,06
5589916;Oprymea (MG) Comp LP 0.52mg 30;Krka;GH1009 - Pramipexol | A102 | Oral | 0.52 mg | [1-30];11,34;7,63;0,0;0,06
5589940;Oprymea (MG) Comp LP 1.05mg 30;Krka;GH1010 - Pramipexol | A102 | Oral | 1.05 mg | [1-30];21,84;15,59;0,0;0,06
9658609;Magnesiocard sem Açúcar Pó sol oral saq 1229.6mg 20;Tecnimede;H05.4.1. - Suplementos Magnésio;0,0;5,0;0,33;0,06
5172317;Cilazapril Generis (MG) Comp revest 2.5mg 56;Generis;GH0719 - Cilazapril | A101 | Oral | 2.5 mg | [21-60];9,38;6,48;0,3;0,06
8916304;Calcium Sandoz Forte Comp eferv 875mg+1132mg 20;Sandoz;H10.3.1. - Suplementos de Cálcio e Fortificantes dos ossos;8,77;5,95;0,0;0,06
5719729;Naproxeno Generis (MG) Comp 500mg 60;Generis;GH0491 - Naproxeno | A101 | Oral | 500 mg | [21-60];9,32;6,43;0,4;0,06
5600234;Nifedipina Generis (MG) Comp LP 30mg 28;Generis;GH1021 - Nifedipina | A102 | Oral | 30 mg | [1-30];4,8;3,36;0,0;0,06
5170451;Cilazapril/Hidroclorotiazida Generis (MG) Comp revest 5mg+12.5mg 56;Generis;GH0716 - Cilazapril + Hidroclorotiazida | A101 | Oral | 5 mg + 12.5 mg | [21-60];13,42;9,41;0,3;0,06
5719711;Naproxeno Generis (MG) Comp 500mg 20;Generis;GH0490 - Naproxeno | A101 | Oral | 500 mg | [1-20];4,18;2,82;0,4;0,06
5468863;Naproxeno Krka Comp revest 500mg 20;Krka;GH0490 - Naproxeno | A101 | Oral | 500 mg | [1-20];2,97;1,78;0,35;0,06
5475108;Naproxeno Krka Comp revest 500mg 60;Krka;GH0491 - Naproxeno | A101 | Oral | 500 mg | [21-60];7,83;5,16;0,35;0,06
5742929;Pregabalina Generis (MG) Cáps 225mg 56;Generis;GH1035 - Pregabalina | A101 | Oral | 225 mg | [21-60];45,38;33,03;0,5;0,06
5742838;Pregabalina Generis (MG) Cáps 100mg 84;Generis;GH1032 - Pregabalina | A101 | Oral | 100 mg | [21-90];37,36;25,95;0,5;0,06
7375352;Fresubin DB Creme Creme Cappuccino 4x125g;Fresenius Kabi;H13.4.1. - Alimentação específica na diabetes;14,49656;10,52;0,25;0,06
5742820;Pregabalina Generis (MG) Cáps 75mg 56;Generis;GH1031 - Pregabalina | A101 | Oral | 75 mg | [21-90];12,67;8,75;0,5;0,06
5781976;Nebivolol Krka (MG) Comp 5mg 28;Krka;GH0649 - Nebivolol | A101 | Oral | 5 mg | [21-60];4,73;3,32;0,5;0,06
5789235;Pitavastatina Krka (MG) Comp revest 1mg 28;Krka;GH0000 - Sem Grupo Homogéneo;8,27;5,55;0,58;0,06
5743034;Pregabalina Generis (MG) Cáps 300mg 56;Generis;GH1036 - Pregabalina | A101 | Oral | 300 mg | [21-60];48,22;35,54;0,5;0,06
5665153;Tramadol/Paracetamol Aurovitas (MG) Comp revest 37.5mg+325mg 20;Generis;GH0735 - Tramadol + Paracetamol | A101 | Oral | 37.5 mg + 325 mg | [1-20];1,68;0,64;0,15;0,06
5743026;Pregabalina Generis (MG) Cáps 25mg 56;Generis;GH1028 - Pregabalina | A101 | Oral | 25 mg | [21-60];8,34;5,58;0,5;0,06
5742846;Pregabalina Generis (MG) Cáps 150mg 56;Generis;GH1033 - Pregabalina | A101 | Oral | 150 mg | [21-60];18,49;12,57;0,5;0,06
5742804;Pregabalina Generis (MG) Cáps 50mg 56;Generis;GH1029 - Pregabalina | A101 | Oral | 50 mg | [21-90];9,78;6,83;0,5;0,06
5742812;Pregabalina Generis (MG) Cáps 75mg 14;Generis;GH1030 - Pregabalina | A101 | Oral | 75 mg | [1-20];5,91;4,33;0,0;0,06
5605076;Raloxifeno Aurobindo (MG) Comp revest 60mg 14;Generis;GH0940 - Raloxifeno | A101 | Oral | 60 mg | [1-20] unidades;5,39;3,88;0,0;0,04
5742853;Pregabalina Generis (MG) Cáps 200mg 84;Generis;GH1034 - Pregabalina | A101 | Oral | 200 mg | [21-90];54,84;41,39;0,5;0,06
5781950;Nebivolol Krka (MG) Comp 5mg 14;Krka;GH0648 - Nebivolol | A101 | Oral | 5 mg | [1-20];3,15;1,94;0,5;0,06
6671941;Fresubin DB Creme Creme Pêssego/Alperce 4x125g;Fresenius Kabi;H13.4.1. - Alimentação específica na diabetes;14,49656;10,52;0,25;0,23
6603001;Dolmix Comp 28;Azevedos;H10.2.1. - Prevenção e/ou alívio de dores articulares;20,0;13,01;0,05;0,23
5771001;Rivastigmina Generis (MG) Adesivo transder 9.5mg/24h 30;Generis;GH0965 - Rivastigmina | A204 | Transdérmica | 9.5 mg/24 h | [11-30] unidades;42,72;30,68;0,25;0,06
5723549;Zolpidem Generis (MG) Comp revest 10mg 14;Generis;GH0241 - Zolpidem | A101 | Oral | 10 mg | [1-20];2,27;1,16;0,3;0,06
5771027;Rivastigmina Generis (MG) Adesivo transder 4.6mg/24h 30;Generis;GH0964 - Rivastigmina | A204 | Transdérmica | 4.6 mg/24 h | [11-30] unidades;42,48;30,47;0,35;0,06
5789276;Pitavastatina Krka (MG) Comp revest 4mg 28;Krka;GH0000 - Sem Grupo Homogéneo;19,36;13,41;0,58;0,06
5782057;Dutasterida/Tansulosina TAD (MG) Cáps 0.5mg+0.4mg 30;Krka;GH1177 - Dutasterida + Tansulosina | A101 | Oral | 0.5 mg + 0.4 mg | [21-60] unidades;10,7;7,07;0,5;0,06
5789227;Pitavastatina Krka (MG) Comp revest 1mg 7;Krka;GH1186 - Pitavastatina | A101 | Oral | 1 mg | [1-20] unidades;2,45;1,33;0,58;0,06
5789250;Pitavastatina Krka (MG) Comp revest 2mg 28;Krka;GH0000 - Sem Grupo Homogéneo;10,41;6,81;0,58;0,06
5121058;Ramipril Bluepharma (MG) Comp 2.5mg 10;Bluepharma;GH0335 - Ramipril | A101 | Oral | 2.5 mg | [1-20];2,5;1,36;0,0;0,06
2364495;Diclofenac Mylan Cáps LP 100mg 30;Mylan;GH0000 - Sem Grupo Homogéneo;4,82;3,4;0,4;0,06
2501088;Ranitidina Mylan (MG) Comp revest 300mg 60;Mylan;GH0126 - Ranitidina | A101 | Oral | 300 mg | [21-60];17,42;11,7;0,5;0,06
2637593;Ranitidina Generis (MG) Comp revest 150mg 60;Generis;GH0000 - Sem Grupo Homogéneo;9,5;6,59;0,35;0,06
2785699;Diclofenac Labesfal Generis (MG) Cáps LP 100mg 30;Generis;GH0000 - Sem Grupo Homogéneo;4,06;2,72;0,4;0,06
2785798;Diclofenac Labesfal Generis (MG) Sup 100mg 12;Generis;GH0000 - Sem Grupo Homogéneo;2,94;1,74;0,3;0,06
3121985;Carbamazepina Mylan (MG) Comp LP 400mg 60;Mylan;GH0043 - Carbamazepina | A102 | Oral | 400 mg | [21-60];5,81;4,27;0,0;0,06
4009882;Novynette Comp revest 0.15mg+0.02mg 21;Gedeon Richter;GH0917 - Desogestrel + Etinilestradiol | A101 | Oral | 0.15 mg + 0.02 mg | [1-30];4,68;3,28;0,15;0,06
4009981;Novynette Comp revest 0.15mg+0.02mg 63;Gedeon Richter;GH0918 - Desogestrel + Etinilestradiol | A101 | Oral | 0.15 mg + 0.02 mg | [31-90];11,46;7,74;0,15;0,06
4069787;Felodipina Aurovitas (MG) Comp LP 5mg 56;Generis;GH0000 - Sem Grupo Homogéneo;9,81;6,86;0,5;0,06
4918389;Felodipina Mylan (MG) Comp LP 5mg 56;Mylan;GH0000 - Sem Grupo Homogéneo;9,81;6,9;0,4;0,06
4919288;Felodipina Mylan (MG) Comp LP 10mg 56;Mylan;GH0274 - Felodipina | A102 | Oral | 10 mg | [21-60];15,92;10,37;0,4;0,06
5005277;Viartril-S Pó sol oral saq 1500mg 60;Mylan;H10.2.1. - Prevenção e/ou alívio de dores articulares;18,27;12,6;0,0;0,06
5058391;Ranitidina Generis (MG) Comp revest 300mg 60;Generis;GH0126 - Ranitidina | A101 | Oral | 300 mg | [21-60];17,42;11,63;0,35;0,06
5086145;Galantamina Generis (MG) Comp revest 4mg 56;Generis;GH0711 - Galantamina | A101 | Oral | 4 mg | [21-60];25,09;18,36;0,35;0,06
5125299;Ranitidina Bluepharma (MG) Comp revest 150mg 60;Bluepharma;GH0000 - Sem Grupo Homogéneo;9,5;6,59;0,45;0,06
5149463;Fosfomicina Generis (MG) Gran sol oral saq 2000mg 1;Generis;GH0000 - Sem Grupo Homogéneo;3,15;1,93;0,3;0,06
5149471;Fosfomicina Generis (MG) Gran sol oral saq 2000mg 2;Generis;GH0000 - Sem Grupo Homogéneo;4,43;3,04;0,3;0,06
5149505;Fosfomicina Generis (MG) Gran sol oral saq 3000mg 1;Generis;GH0744 - Fosfomicina | A112 | Oral | 3000 mg | [1];3,85;2,54;0,3;0,06
5170550;Cilazapril/Hidroclorotiazida Krka (MG) Comp revest 5mg+12.5mg 14;Krka;GH0715 - Cilazapril + Hidroclorotiazida | A101 | Oral | 5 mg + 12.5 mg | [1-20];3,67;2,39;0,35;0,06
5170840;Cilazapril Generis (MG) Comp revest 1mg 60;Generis;GH0718 - Cilazapril | A101 | Oral | 1 mg | [21-60];5,66;4,11;0,3;0,06
5180336;Glucosamina Generis (MG) Pó sol oral saq 1500mg 60;Generis;H10.2.1. - Prevenção e/ou alívio de dores articulares;12,63;8,77;0,3;0,06
5193537;Lercanidipina Generis (MG) Comp revest 20mg 28;Generis;GH0758 - Lercanidipina | A101 | Oral | 20 mg | [21-60];4,65;3,23;0,3;0,06
5219613;Glucosamina Mylan (MG) Pó sol oral saq 1500mg 60;Mylan;H10.2.1. - Prevenção e/ou alívio de dores articulares;12,69;8,75;0,0;0,06
5223383;Ibuprofeno Generis (MG) Susp oral frasco 20mg/ml 200ml;Generis;H02.1.2. - Analgésico e Antipirético Pediátrico;2,12;1,03;0,1;0,06
5232608;Pramipexol Azevedos (MG) Comp 0.7mg 100;Azevedos;GH0000 - Sem Grupo Homogéneo;59,35;45,6;0,6166999999999999;0,06
5266994;Ranitidina Bluepharma (MG) Comp revest 150mg 20;Bluepharma;GH0000 - Sem Grupo Homogéneo;3,6;2,32;0,0;0,06
5272075;Losartan Aurobindo (MG) Comp revest 25mg 56;Generis;GH0000 - Sem Grupo Homogéneo;5,43;3,91;0,38;0,06
5282132;Aranka (MG) Comp revest 3mg+0.03mg 63;Gedeon Richter;GH0959 - Drospirenona + Etinilestradiol | A101 | Oral | 3 mg + 0.03 mg | 3 CICLOS [63-84];8,22;5,5;0,15;0,06
